{
  "contract_version": "SITES_MEIHUA_API_CONTRACT_V2",
  "request_id": "client-request-id",
  "question_domain": "PROJECT_COOPERATION",
  "decision_goal": "PLAN_NEXT_STEP",
  "time_horizon": "NEXT_30_DAYS",
  "numbers": [100, 27, 368],
  "locale": "zh-CN",
  "client_timestamp": "2026-07-15T10:00:00+08:00",
  "user_acknowledgements": {
    "deterministic_only": true,
    "narrative_unverified": true,
    "structured_question_confirmed": true
  }
}
